text,label_name
go watch halftime repo monday hear explain realize weekend economy bad shape,['business_&_entrepreneurs' 'news_&_social_concern']
kap ft chris brown music video,['celebrity_&_pop_culture' 'film_tv_&_video' 'music']
astro gateway knock fact great asset emotional hu price person pay order independent,['diaries_&_daily_life' 'fitness_&_health' 'other_hobbies']
dear coca cola friend say tell drpepper long manufacture store sure ll tell true news infoneede,['business_&_entrepreneurs' 'food_&_dining' 'news_&_social_concern']
madonna matter official music video matre,['celebrity_&_pop_culture' 'film_tv_&_video' 'music']
wanna know aaron go to dance music video need prepare,['celebrity_&_pop_culture' 'music']
wizkid fc follow turn notification avoid miss poll page battle go page wizkidfc,['celebrity_&_pop_culture' 'news_&_social_concern']
nigerian oil gas industry local content act roadmap africa resource rich country labour,['business_&_entrepreneurs' 'news_&_social_concern']
frailboy love money official music video,['celebrity_&_pop_culture' 'music']
communard friend official music video apt moment underrated classic,['celebrity_&_pop_culture' 'film_tv_&_video' 'music']
wait outro song,['celebrity_&_pop_culture' 'music']
earn god save queen level badge,['gaming']
dee koala khaltsha official music video ft lookatup,['celebrity_&_pop_culture' 'film_tv_&_video' 'music']
million merit minute fame analyse fame worth price soul iteration charlie brooker dystopian future,['arts_&_culture' 'film_tv_&_video']
australia post deeply respect important role licensee play connect australian serve community country postal franchisee wait promise payment reform year auspol,['news_&_social_concern']
gas station finally hear half hea,['celebrity_&_pop_culture' 'music']
dream cheat boyfriend teacher like dream till realise teacher anymore wake hug boyfriend give kiss start get ready work listen music niall,['diaries_&_daily_life' 'music' 'relationships']
come morning spike case weekend ne late number car break in big problem lnk hear mom say happen family costco making change shopper safe pandemic,['news_&_social_concern']
pag ibig fortune cookie mnl music video happyeckaday ourhappinessecka,['celebrity_&_pop_culture' 'music']
flower grass moment flower garden scotland spring loveit brianrenniefashion ferdinandrenniemusic,['diaries_&_daily_life' 'fashion_&_style' 'music']
hi love app love fact take bank account sign pack,['science_&_technology']
sooo unpopular opinion discover roni pasta piss year know need new friend tell stuff fake friend,['food_&_dining' 'relationships']
sister loraine marie maguire mother provincial little sister poor hold hand die elderly time facilitate ending pre bear life faith allow letthemserve,['family' 'news_&_social_concern']
wait friend play acnh far friend personally ask visit island,['gaming' 'relationships']
omg hope miss happy mf nurse day week badd game nursing field,['fitness_&_health' 'gaming']
million view hour music video produce gcf direct jungkook,['celebrity_&_pop_culture' 'film_tv_&_video' 'music']
bestofcapitalstb throwback sister good day travel london weekend big act wait live facetime version year garden,['diaries_&_daily_life' 'family' 'music' 'travel_&_adventure']
hi tell friend bully spamme vic haunt fair pls,['diaries_&_daily_life' 'relationships']
dear tell programmer program alarm name have multiple alarm have name confusing kinda worthless timer absolutely able alarm friend kwh,['science_&_technology']
yo thank huge bag perfect order thank support old video ship order week tho love guy new york new york,['business_&_entrepreneurs']
happy repo ve bit press publication close home time today wonderful appreciate support,['news_&_social_concern']
alex newell celebrate mom mama tell music video mom,['celebrity_&_pop_culture' 'family' 'music']
ristalk ustadha ieasha prime honor woman forget sunnah powerful speech regard place woman society sister leasha great speaker mashallah,['celebrity_&_pop_culture' 'news_&_social_concern']
music video gooba receive million view hour release,['celebrity_&_pop_culture' 'film_tv_&_video' 'music']
queen know greatness cultural moment miss erykahbaduvsjillscott,['arts_&_culture' 'celebrity_&_pop_culture']
dare criticize people united states die hn ebola watch people die coronavirus president trump watch hypocrite,['celebrity_&_pop_culture' 'fitness_&_health' 'news_&_social_concern']
ufc let thank itstime ufc,['sports']
drink absolute sister drink tequila min later sister ai hot sister yeah hott simultaneously laugh,['family' 'food_&_dining']
talk poor student color ivy league real institution mobility united states underfunde public university new,['learning_&_educational' 'news_&_social_concern' 'youth_&_student_life']
aye lil sister say love versus battle showtime,['arts_&_culture' 'celebrity_&_pop_culture' 'music']
ufc ppv start minute life good ufc,['sports']
ufc stacked card,['sports']
lose make feel like want die sister man die test positive covid otay mesa detention center say news san,['fitness_&_health' 'news_&_social_concern']
watch happen broadcast ufc,['film_tv_&_video' 'sports']
chris brown jr happy glo hope day bless,['celebrity_&_pop_culture']
stop sale foot hold leg hold trap snare united states sign petition,['news_&_social_concern']
president united states america spend saturday watch tv national crisis,['diaries_&_daily_life' 'news_&_social_concern']
happy mother day super mom especially mother good ilyma sbxa tin sb,['diaries_&_daily_life' 'family' 'relationships']
happy mother day mama especially sissy don forget iloveyou matter mwaaaah,['diaries_&_daily_life' 'family' 'relationships']
happy mommy day queen especially queen pay year thankless child rearing official photographer editor thank,['diaries_&_daily_life' 'family' 'relationships']
expert release migrant detention center united states,['fitness_&_health' 'news_&_social_concern']
united states coronavirus case death worldometer america god awful maga,['fitness_&_health' 'news_&_social_concern']
lovely md happy husband home able chat mum sister wa online miss sil suppose watch kid grow donate foundation cancer honour mothersday,['diaries_&_daily_life' 'family' 'relationships']
bless day sister eunice njeri,['diaries_&_daily_life' 'family' 'relationships']
happy mother day beautiful sister thank bless nephew,['diaries_&_daily_life' 'family' 'relationships']
hi parent mumbai need travel new york asap sister pregnancy ve contact helpline book ticket special flight ewr haven get tell proceed,['diaries_&_daily_life' 'travel_&_adventure']
happy mother day sister chunk get suppo system love seein post great mom love,['family' 'relationships']
ufc result bryce mitchell put grapple clinic dominate charle rosa mma junkie,['sports']
president united states release political prisoner conscious kampanyaya imza ver,['news_&_social_concern']
vase light dining table accidentally tap knife de noise sister reaction dinner serve tell watch say morning,['diaries_&_daily_life' 'family']
let respect woman mother give life couldn bless woman mother,['diaries_&_daily_life' 'family']
single day define mother day mother day imagine life maa happy mother day,['diaries_&_daily_life' 'family']
parasitism adult pentatomidae tachinidae soybean north central region united states jisci,['science_&_technology']
happy mother day mamabae hendrinakhanyile number fan loud cheerleader therapist fun maker hard worker know thank make sister literally,['diaries_&_daily_life' 'family']
mother beginning thing begin happy mother day imagine life mom rakshameehnia sure agree meehnia mother mothersday mommy,['diaries_&_daily_life' 'family' 'relationships']
awesome fight ufc card today time jump level competition get camo,['sports']
meeting fifth lockdown stop spread coronavirus start march lockdownextension lockdown indiafightscovid,['fitness_&_health' 'news_&_social_concern']
happy dominick cruz getting knock henry cejudo essentially sport,['sports']
doesn think legend grow big ufc casual,['sports']
estimate infection fatality rate symptomatic case united states interested mortality subgroup datum disparity,['diaries_&_daily_life' 'fitness_&_health' 'news_&_social_concern']
united states record death hour,['fitness_&_health' 'news_&_social_concern']
happy mother day beautiful lovely mother especially mother life gud lord continue bless love,['diaries_&_daily_life' 'family' 'relationships']
submarineschool submarine seabee usn usnavy navy military maga check vintage united states naval submarine school large mug clear glass usn navy,['other_hobbies']
happy st mother day sister thank make god mother love nasir long time,['diaries_&_daily_life' 'family']
happy mother day mother especially mom micoledy,['diaries_&_daily_life' 'family']
new tumblr post sister city hotel hotel ma cherie photography mimp nyc hotel,['travel_&_adventure']
happy mother day sister payten yo clone fr wouldn want way,['diaries_&_daily_life' 'family']
happy mother day fellow female evergreen coach great mother juggle crazy schedule lot work worth,['diaries_&_daily_life' 'family']
happy mother day twin sister brilliant mom nyc,['diaries_&_daily_life' 'family']
refugee woman campmoria ask clean islamicclothing donate hijab refugee sister buy online shop ramadan ramadankareem refugeeaid refugeesgr refugeecharity ukcharity,['fashion_&_style' 'news_&_social_concern']
happy st mother day sister love mama happy baby adrian finally meet world go to amazing mommy wait meet lil nephew iloveyou,['diaries_&_daily_life' 'family']
happy mother day terrific mom especially tennis mom stepmom rock,['diaries_&_daily_life' 'family']
signifyd good place work fifth year row find bayareabptw,['business_&_entrepreneurs']
shoutout sister friend lover girl definitely day stay genuine person genuine tauru like great thing mother day child wish blessing great thing year,['diaries_&_daily_life' 'family']
happy mother day sister good mom proud sis,['diaries_&_daily_life' 'family']
hilarious moment little boy sister shave head electric razor mail hope find chris,['diaries_&_daily_life' 'family']
happy mother day truly important job bless great mother proud absolute good mom raise boy love happymothersday,['diaries_&_daily_life' 'family' 'relationships']
mad world ufc fan fighter hear pundit mailonline coronavirus news noticias bitcoin cryptocurrency forex,['news_&_social_concern' 'sports']
wedding photo rev sister leave convent marry police man naijapalaba,['relationships']
trump pompous twit dr dave rants great president united states donald trump,['news_&_social_concern']
behalf government united states american people congratulate citizen european union celebrate europeday,['news_&_social_concern']
old woman base united states collapse die delta hotel,['news_&_social_concern']
happy mother day lil sister love girl,['diaries_&_daily_life' 'family' 'relationships']
happy mother day momma especially one commit match little bodenbyme liketkit,['diaries_&_daily_life' 'family' 'relationships']
ufc success boxing soon box ufc lockdown,['sports']
little sister trina speaker bust,['family']
post play beginning chris brown favourite highlight loss joker nsv,['celebrity_&_pop_culture' 'music' 'sports']
kara year apa concern health risk go general population bring home infect look sister get sick bad isn game,['family' 'news_&_social_concern']
ufc result francis ngannou score highlight reel ko floor jairzinho rozenstruik seconds,['sports']
brooke finish cole slaw spicy sister white person,['diaries_&_daily_life' 'family' 'food_&_dining']
honestly think clear boarder security nigeria number target control boarder south africa ghana steal year like china international market honestly believe build wall,['news_&_social_concern']
president united states approve potential life save medication fbl og pancreatic cancer treatment sign petition,['news_&_social_concern']
mma mania ferguson suffer fractured orbital ufc loss justin gaethje,['sports']
announcement timee sister rene account bff jackie follow rene jacki need help haha,['family' 'relationships']
savior sister available presale writingcommmunity preorder savior amazon amazon amazon uk,['arts_&_culture' 'diaries_&_daily_life' 'family']
ufc like need support follow mastipapi desimemes carryminati urdumemes pakistanimeme halalmemes punjabimeme indianmeme muslimmeme,['sports']
watch ufc saturday great live sport stand,['sports']
hang andrew sister amazing hospitality place rest journey delicious breakfast row seat disney family sing long,['diaries_&_daily_life' 'family']
stiller live fifth floor live fourteen yaddoartist share priceless new york memory word jerry stiller,['celebrity_&_pop_culture' 'diaries_&_daily_life']
st look northern colorado new water park,['news_&_social_concern' 'travel_&_adventure']
new set new opening date june th water park july th,['business_&_entrepreneurs' 'travel_&_adventure']
get lot problem people strike air happy festivus rest power jerry stiller yamahamafrightnight,['celebrity_&_pop_culture' 'film_tv_&_video']
live sport tonight weird watch fan live sporting event overeem vs harris ya get,['film_tv_&_video' 'sports']
festivus episode classic rip jerry stiller legend,['celebrity_&_pop_culture' 'film_tv_&_video']
pro wrestler wanna binge watch simpson start moth pretty sure end game,['film_tv_&_video' 'sports']
time navy grant waiver allow transgender sailor continue military service despite president ban transgender people serve openly armed force let trump fire,['news_&_social_concern']
happy armed force day thankyouforyourservice,['news_&_social_concern' 'other_hobbies']
good decision take central government stimulus package hope benchmark party make sure implement fail reach people,['news_&_social_concern']
future work young thug travis scott high life,['celebrity_&_pop_culture' 'music']
switch streamlab obs setting mess couple minor tweak right thank stay problem special thank follow tjbean tinkerbell,['film_tv_&_video']
week chat suppo non existent twitter recommendation give hulu,['film_tv_&_video']
bear lachin occupy armed force year ago today see soldier gun today million citizen deprive right live land result armenianagression human,['diaries_&_daily_life' 'news_&_social_concern']
come kevin gates sextape,['celebrity_&_pop_culture']
animate atrocity ba itchy scratchy simpson wow simpson yeesh,['film_tv_&_video']
high life close thing ds get year happy,['diaries_&_daily_life']
know zen master thing culture case make sure magnificent youtube playing prince concert,['arts_&_culture' 'celebrity_&_pop_culture' 'film_tv_&_video' 'music']
oh look go away make sure don need advise economy build corruption loose end keep eye investment crime corruption report,['news_&_social_concern']
wetherspoon look juan roig foundernof mercadona chain spain pay staff work day week tha sta lockdown staff extra week pay give nearly help aid supplier,['celebrity_&_pop_culture' 'news_&_social_concern']
vale fred willard talented comic actor pass away day jerry stiller sad,['celebrity_&_pop_culture' 'film_tv_&_video']
trump declare vaccine vaccine coronavirus death week go right end march cycle repeat vaccine find,['fitness_&_health' 'news_&_social_concern']
come possession document show senior officer iranian military order replace word iran armed force prayer ceremony islam revolution,['news_&_social_concern']
little acorn episode go right beginning faithathome allarewelcome,['film_tv_&_video']
late uk armed force tweetheart daily thank milspouse deployment,['news_&_social_concern']
simpson franchise ruin finally toon patrol scrooge mcduck come earn,['film_tv_&_video']
late boston news fly thank,['news_&_social_concern']
see ryan taylor water park couple year ago kid turn head see thing see year say hi sing ryan taylor wall nufc,['celebrity_&_pop_culture' 'diaries_&_daily_life' 'sports']
calm ill right honey xx,['diaries_&_daily_life' 'other_hobbies']
hoyyy twitter act unfollowe message follow not leave moot huhu treasure world domination treasure,['diaries_&_daily_life']
crack open water swim today courtesy week surprised remember stay afloat bit nippy definitely wake boundary water park,['sports' 'travel_&_adventure']
jerry stiller great moment seinfeld continue effo provide sport entertainment news goodnew humor nopolitic,"['celebrity_&_pop_culture' 'diaries_&_daily_life' 'film_tv_&_video'
 'news_&_social_concern']"
simpson golden era good influential show guide look watch time,['film_tv_&_video']
rapper kevin gates sextape leak go viral twitter graphic news info,['celebrity_&_pop_culture' 'news_&_social_concern']
jerry stiller great moment seinfeld,['celebrity_&_pop_culture' 'film_tv_&_video']
lord sumption news people want continue self isolate don nurse key worker risk life selfish prick think stay home soon covidiot,['fitness_&_health' 'news_&_social_concern']
fernwood night talk jew jerry stiller talk,['film_tv_&_video']
buzz live sport action evening good luck,['sports']
yes watch right need live sport golf come actually watch heck,['film_tv_&_video' 'sports']
new york heartbreaking destiny situation work hard fault bring right source trauma,['news_&_social_concern']
look live sport nascar race fox,['sports']
nascarisback wait watch live sport time month nascar sport,['sports']
drivingrelief golf today glad live sport socialdistance hopefully work safe,['sports']
big nascar fan watch cover fascinating certainly gauge ll live sport cover foreseeable future,['sports']
live sport engine fire let race therealheroe,['film_tv_&_video' 'sports']
moment read courage incredible sacrifice nurse line tactical care unit hero honor well pa limit spread virus,['fitness_&_health' 'news_&_social_concern']
nascar today live sport yeah,['sports']
lbc set new bbc music play soundbite thesimpson,['arts_&_culture' 'film_tv_&_video']
happy thank god live sport tv,['film_tv_&_video' 'sports']
breaking canadian armed force acrobatic snowbird jet crash british columbia aircraft take pa cross country tour aim boost morale canadian struggle pandemic associate,['news_&_social_concern']
yes live sport nascarisback luckily unlike sport crowd noise create good product unlike exception,['film_tv_&_video' 'news_&_social_concern' 'sports']
lap bring car pit road tire fuel track bar adjustment say car isn turn turn come leave,['sports' 'travel_&_adventure']
quick somebody fire blue emu give end race nascarisback,['sports']
lap bring light yourfacehere pit road tire fuel attempt add tape wouldn stick come leave,['sports']
late boston news fly thank commencement food,['news_&_social_concern']
proud small pa drivingrelief thank player partner seminole gc gracious host amazing cause need live sport time tee colonial,['news_&_social_concern' 'sports']
recap simpson talk book role lisa simpson star house,['celebrity_&_pop_culture' 'film_tv_&_video']
congratulation kevin harvick live sport tv,['film_tv_&_video' 'sports']
finally live sport tv star bakersfield native get,['news_&_social_concern' 'sports']
feel nice live sport familiar face friend colleague tv today taylormadedrivingrelief mattwolf appreciate take pull thank,['celebrity_&_pop_culture' 'film_tv_&_video' 'sports']
katy perry perform baby poodle nugget disney fam version come little baby bogp expect costume,['celebrity_&_pop_culture' 'music' 'news_&_social_concern']
listen new album high life apple music,['music']
awesome watch live sport great job fun afternoon,['sports']
admire massive effo race bring sport day remember turning point return live sport competition nascarisback,['sports']
funnel dead long live fly wheel word totally word mouth break thank elevatelive informative webinar marketing digitalmarketing,['business_&_entrepreneurs' 'learning_&_educational']
allah lead path honesty prosperity bless happiness heaven eid mubarak isar,['news_&_social_concern' 'other_hobbies']
eid mubarak observe eid today abbas shahnawaz jai mohame,['arts_&_culture' 'news_&_social_concern']
wish family wonderful eid allah accept prayer eid mubarak eidwithbangtan eidwithbt eidwith eidulfitr,['arts_&_culture' 'family' 'relationships']
eid mubarak hope have beautiful time home family,['arts_&_culture' 'family' 'relationships']
eid fitr muslim brother sister,['arts_&_culture' 'family' 'relationships']
jane roe demand raise anti abortion activist,['news_&_social_concern']
eid bring joy unlimited wish come true holy day allah approve kind deed forgive disobedience sin ease suffering individual globe eid mubarak regard sa hil farhat,['arts_&_culture' 'family' 'other_hobbies' 'relationships']
brother sister friend family eid mubarak heart pray almighty make life beautiful struggle meaningful eid mubarak elimikawikiendi,['diaries_&_daily_life' 'family' 'relationships']
pay day fed cerb day apply bcebw wait wait manual processing answer work clock bc pay story news,['news_&_social_concern']
eid mubarak like subscribe channel share recipe friend family eid eid eidathome eidmubarakh eidmubarek eid,"['arts_&_culture' 'family' 'film_tv_&_video' 'food_&_dining'
 'relationships']"
congratulation completion ramadan fast almighty allah accept good deed forgive shortcoming answer supplication aameen eid mubarak abdurrazaq muhammad hamza,['arts_&_culture' 'diaries_&_daily_life' 'relationships']
eid mubarak weldon fawad heartily condemn mufti muneeb insult behaviour,"['arts_&_culture' 'diaries_&_daily_life' 'news_&_social_concern'
 'relationships']"
wish homie happy eid mubarak,['diaries_&_daily_life' 'relationships']
eid mubarak favourite scholar teacher hope reply,['arts_&_culture' 'diaries_&_daily_life' 'relationships']
hope eid mark resumption good world kolkata bengal need good vibe come way thank stand city time need appreciate support,"['arts_&_culture' 'diaries_&_daily_life' 'family' 'news_&_social_concern'
 'relationships']"
eid mubarak today let hug corona fight measure take plegde social distancing wear mask wash hand frequently boost immunity house hold measure haldar milk garlic reciepe kumar,['arts_&_culture' 'news_&_social_concern' 'relationships']
eid mubarak don forget pound yam,['arts_&_culture' 'diaries_&_daily_life' 'food_&_dining']
eid mubarak muslims demand world muslim look oppress want brother abduct enforce pakistani torture cell ullah baloch ecosoc,"['arts_&_culture' 'diaries_&_daily_life' 'family' 'news_&_social_concern'
 'relationships']"
wish student client friend family happy eid mubarak dbta team lashesbyaidax kathsmith ssbaesthetics,['arts_&_culture' 'diaries_&_daily_life' 'family' 'relationships']
wait refund cruise depart nd april tell week refund week ago customer service speak agent utterly ineffective help,['business_&_entrepreneurs' 'diaries_&_daily_life' 'travel_&_adventure']
eid mubarak muslim brother sister lago nigeria,['arts_&_culture' 'diaries_&_daily_life' 'family' 'relationships']
eid mubarak love allah protect embrace forever enjoy habibty,['arts_&_culture' 'diaries_&_daily_life' 'family' 'relationships']
wish muslim platform happy eid allah restore energy answer prayer,['arts_&_culture' 'diaries_&_daily_life' 'family' 'relationships']
eid mubarak allah blessing today tomorrow eid mubarak muslim allah time bless dream ameen,['arts_&_culture' 'diaries_&_daily_life' 'family' 'relationships']
eid mubarak love care follower,"['arts_&_culture' 'celebrity_&_pop_culture' 'diaries_&_daily_life'
 'relationships']"
openictincbicnow plz open ict cbic sir phone happy eid happy diwali happy holi kb tk krte rhenge hume humare shehar bheja jaye hume humare gaoon bheja jaye open inter zonal transfer cbic,['arts_&_culture' 'diaries_&_daily_life' 'news_&_social_concern']
eid mubarak abundant blessing beautiful family,['arts_&_culture' 'diaries_&_daily_life' 'family' 'relationships']
happy eid mubarak muslim brother sister eidmubarak forget meat,['arts_&_culture' 'diaries_&_daily_life' 'family' 'relationships']
late school app daily thank,['diaries_&_daily_life' 'learning_&_educational' 'youth_&_student_life']
learning difficult work experience incompetence way mastery,['learning_&_educational']
wa minkum blessing allah family forever eid mubarak,['arts_&_culture' 'diaries_&_daily_life' 'family' 'relationships']
interesting conversation japanese boom bust minute reveal bank japan want recovery recession serve political purpose engineer structural reform,['business_&_entrepreneurs' 'news_&_social_concern']
eid mubarak aptly definitely remember hope enjoy gratitude level time able spend time love one sure roof,['arts_&_culture' 'diaries_&_daily_life' 'family' 'relationships']
dig heal cumming show leader rid cumming long go well scot gov look hasn show face disgraceful,['news_&_social_concern']
eid mubarak friend wide muslim community wish happy eid al fitr eidmubarak,['arts_&_culture' 'diaries_&_daily_life' 'family' 'relationships']
god almighty open door happiness fulfil ur dream eid mubarak ur family eidmubarakasim,['arts_&_culture' 'diaries_&_daily_life' 'family' 'relationships']
dear value customer prinake gh wish loved one happy eid ul fitr allah blessing peace auto trading gh safety priority,"['arts_&_culture' 'business_&_entrepreneurs' 'diaries_&_daily_life'
 'family' 'relationships']"
eid mubarak message send friend family,['arts_&_culture' 'diaries_&_daily_life' 'family' 'relationships']
excited announce launch projectpsychology bring oup episode pleasure interview reply tweet question guest bst today chance include podcast,['business_&_entrepreneurs' 'film_tv_&_video' 'news_&_social_concern']
dam blast stream episode higurashi visual novel love rena starm get spook,['arts_&_culture' 'film_tv_&_video']
happy eid muslim brother let observe physical distance wear mask let stop spread covid south,"['arts_&_culture' 'diaries_&_daily_life' 'family' 'fitness_&_health'
 'news_&_social_concern' 'relationships']"
auspicious occasion eid bless peace bring joy hea home eid mubarak,['diaries_&_daily_life' 'family']
