text,label_name
nepal start decade action globalgoal new year resolution help world well place country team,['news_&_social_concern']
americans collaborative new york met win world series single year write history decade,['celebrity_&_pop_culture' 'sports']
new year decade define collapse black wealth excellent appreciate candidness,['diaries_&_daily_life' 'news_&_social_concern']
humble verse new album sigue la movida,['celebrity_&_pop_culture' 'music']
watch laker game go to watch melt entertaining,['film_tv_&_video' 'gaming' 'sports']
see drill three laker get hype,['sports']
turn espnnew instead want watch laker game xfinity,['sports']
blessed share bring beautiful family maria matisse miro catalinabarandgrill happy new year,['diaries_&_daily_life' 'family']
nopvslal laker play lazy defense slow,['sports']
finally finish watch firefly importantly serenity finish movie yell happy,['film_tv_&_video']
new year new phone save use referral signup renew mint mobile cell wireless deal refer promo code android apple sim referral att tmobile sprint verizon url holiday free save lte service promocode prepay,['business_&_entrepreneurs' 'science_&_technology']
delay penalty laker sydney breza goal red advantage trip letsgore,['celebrity_&_pop_culture' 'sports']
song win song decade song year reach new year eve tom slick radio rock blitz shy usa hope guy like,['celebrity_&_pop_culture' 'music']
catch cry friday new album rare co author,['celebrity_&_pop_culture' 'music']
plz sign help end dogfight stop dog fighting punish elmer james givens jr extent law sign petition org,['celebrity_&_pop_culture' 'news_&_social_concern']
ight try place wager min sta game go customer,['sports']
remember celebrate beat cowboy like win super bowl enjoy playoff game team watch home buffalobills bills buffalo nfl,['gaming' 'sports']
stop love thing game tell bill room growth go to look forward see gobill,['gaming' 'sports']
spur lonnie walker walker get sta road tonight gospursgo,['celebrity_&_pop_culture' 'sports']
ateez dare release new bop new bop tired excited time probably die tomorrow answer performance,['celebrity_&_pop_culture' 'diaries_&_daily_life' 'music']
say season bill year away playoff year bonus good young core group lead qb allen year develop defense tact draft wr use cap space wisely set long term success,['sports']
real question st want win super bowl,['celebrity_&_pop_culture' 'sports']
arrive new york look forward,['diaries_&_daily_life' 'travel_&_adventure']
look forward sa starla song boy starlastarrysunday tntboy asapnatinto natin,['celebrity_&_pop_culture' 'music']
close carry defender play sta run lot time clock get to end point titanup,['celebrity_&_pop_culture' 'sports']
catch attention taehyung bias taetae current bias taetae current bias wrecker ot bts mv dope fav song love song spring day fire fake love butterfly pass,['celebrity_&_pop_culture' 'music']
listen ep tweet hear correctly fnma fhlmc lead financial crisis mean eventually bake institution start,['business_&_entrepreneurs' 'news_&_social_concern']
dream walk friend say not weird hatsune miku come hatsune miku wig tell shut,['celebrity_&_pop_culture' 'diaries_&_daily_life']
ok raven good team nfl right past legitimate chance super bowl,['sports']
sorry miss meeting newcastle week large contingent go hope organising go smoothly look forward follow news hesgncl,['business_&_entrepreneurs' 'diaries_&_daily_life' 'news_&_social_concern']
look forward jona natin year asapfearlesspasabog jona,['celebrity_&_pop_culture' 'music']
look forward match cfp national championship aussie fan tuesday pm college,['sports']
gbas gbo come think song ll mad,['celebrity_&_pop_culture' 'film_tv_&_video' 'music']
super bowl jewish learning wall street journal,['arts_&_culture' 'news_&_social_concern']
infographic prediction industry prioritize simplicity decade data drive transformation like datadriven,['news_&_social_concern' 'science_&_technology']
home safe easily favorite theirs proud pa new south family,['family' 'film_tv_&_video']
look forward debut dustin,['news_&_social_concern' 'sports']
ufscnet ufscmswc ufsclifestyle ufscculture ufscphilosophy hcp wblendingsolution financial service vision ensure equitable participation people color,['arts_&_culture' 'news_&_social_concern']
look forward today game today long guy action royalfamily,['family' 'sports']
fair play wear town shi morning look forward purchase cook book,['celebrity_&_pop_culture' 'food_&_dining']
tax cut year later lot think wall street,['news_&_social_concern']
yao li spring breeze kiss face hear old school fm radio morning set mood sta year,['film_tv_&_video' 'music']
new release delighten mind flawless tune maaybhavani audio yt tanhajitheunsungwarriror unique bit nail music atul lyric link,['film_tv_&_video' 'music']
late sta inspire daily thank ai ct,['film_tv_&_video']
lot fun league game mid october right result hallam well vague memory previous home game cause problem start,['gaming' 'sports']
night come great idea coc let writing begin write mean think crazy idea,['arts_&_culture' 'gaming' 'learning_&_educational']
boldero family finish christmas style afternoon look forward see well,['family']
look forward course reconcile biomechanic pain science course dr greg lehman hold malta book link vicinity malta join,['science_&_technology']
fab author donate sign book illo suppo cfa twitter auction look forward bid tomorrow authorsforfirey great initiative,['arts_&_culture' 'learning_&_educational']
advent federalization nepal delegate crucial role regional development provincial government country write researcher prience shrestha today read article,['news_&_social_concern']
love boy look carefree happy lately ignore negativity focus love music fan perfect energy bring new year decade,['music']
look forward group talent dream don waste time let debut learn mistake good artist don work hard hide building yglettreasuredebut,['music']
congrat julie fabulous talk eoe foodallergy look forward hilllab,['food_&_dining' 'news_&_social_concern']
sad sad day england super bowl year mean bout black quaterback win super bowl blackqbmatter,['sports']
understand extent look uk look trade good particularly reliant dover calais crossing say foreign secretary,['business_&_entrepreneurs' 'news_&_social_concern']
plan share bear piano eca group go create cityscape find blog draw bear look forward create need order light cotton rock,['celebrity_&_pop_culture' 'music']
look forward spend day nrf work collaboration team speedvisory session video shoot keynote presentation,['science_&_technology']
look forward hear preach hebrews covenant fellowship church morning begin week prayer fast church family join,['diaries_&_daily_life' 'family']
look forward gueste nellie tomorrow th january wassail chorus song instrumental ready welcome springtime,['music']
surprise min mental health clip show motd show ground start massive reach live,['fitness_&_health' 'sports']
look forward chair work move forward reduce meat use publicsector listen customer drive forward leadingtheway,['business_&_entrepreneurs' 'news_&_social_concern']
look forward watch place viewing dublin,['film_tv_&_video']
plz subscribe update mailing list ll notification pertain war legislation dc antiwar ll detail bill script info state rep ndaa come,['news_&_social_concern']
excited start jpmorganchase virtual experience look forward try like work jpmorgan chase thank opportunity jpmorganchase,['business_&_entrepreneurs' 'celebrity_&_pop_culture']
smile time watch kathryn vlog freakin wonderful witness love like theirs start like deserve love,['film_tv_&_video' 'news_&_social_concern' 'other_hobbies']
thug manhandle outside jnu glare medium imagine student inside jnuviolence,['news_&_social_concern']
storm asia year later,['news_&_social_concern' 'sports']
scrap hs want rinky dink train line safe use clock victorian common sense prime transportation transport,['news_&_social_concern' 'travel_&_adventure']
dear win retweet don spoil post major epic change spoiler chance viewer cable look forward see spyfall theater later today,['film_tv_&_video']
stream poplar bluff mccracken county game youtube,['sports']
northern ireland hit cruelty iain duncan smith policy disastrous effect clear quickly happen supporter disastrous policy explain away time,['news_&_social_concern']
look forward sas dare win love book everest tv look forward read,['arts_&_culture' 'film_tv_&_video']
look forward busy new term lot exciting new project gcse exam paper tomorrow suppo session school monday tuesday,['learning_&_educational']
play super bowl year,['music' 'sports']
tangle blue tell story origin anti catholicism ranger club recent liquidation disgrace amazon spend christmas money,['sports']
new episode week studio episode review brewnecorn finally available tulsa lizard people drekkerbrewe look forward new taproom,['food_&_dining' 'music']
look forward roundtable discussion philipp stelzel history hitler transatlantic enterprise comment donna harsch,['arts_&_culture' 'learning_&_educational']
need win super bowl bill,['celebrity_&_pop_culture' 'sports']
st catch attention kim taehyung bias kim taehyung current bias kim taehyung wrecker jk suga jin namjoon hobi jimin bts mv dope fav song crystal snow pass,['celebrity_&_pop_culture' 'music']
year heartbreak orleans thank good league go to hu whodat,['celebrity_&_pop_culture' 'sports']
cheer couch today mind location cheer super bowl alaskahappyhour,['celebrity_&_pop_culture' 'sports']
dear gbvssf nfcchampionshipgame niner fan exorcise demon want play raven super bowl,['sports']
choke super bowl great dynasty time excuse year orleans,['sports']
omg finally get episode clear death progress songofhorror hope enjoy game look forward episode horror game,['gaming']
musicofthefuturevideooftheweek live feature watch video lonewolf watch subscribe follow intuition drop,['music']
like tonight sta win award cause need win oscar,['celebrity_&_pop_culture' 'film_tv_&_video']
look forward get road suppo tab benoit go to pop blue cruise,['music' 'travel_&_adventure']
happy new year hawk look forward see tomorrow white day er week principal note holmeshawkssoar,['sports' 'youth_&_student_life']
nuuanu ymca member sau chun recently feature kupuna life segment sau member stay healthy wonderful positive philosophy life give group water exercise class watch segment,['fitness_&_health']
thing look forward year insurance rate go goal,['diaries_&_daily_life']
look forward new lineup monday kick morning drive break game talk noon debut new sport connection,['sports']
kumusta naman day school nyo pushawardsatin sb thankyou ken,['diaries_&_daily_life' 'learning_&_educational']
day class go look forward semester vision ilovemystudent,['diaries_&_daily_life' 'learning_&_educational' 'youth_&_student_life']
look forward hear pagefield advisory board member british ambassador united states discuss uk special relationship shortly tune,['news_&_social_concern']
saturday action wrap raven face titans check pick prediction help bet game nfl pick prediction divisional raven titan spreadhacker,['sports']
puerto rico hit earthquake cnn puertoricoearthquake heartbroken family friend diaspora island,['news_&_social_concern']
pick titan today cover ignore score time lose september mvp qb titans beat collapse patriot team week let overplay bet raven nflplayoffs nfl balvsten,['sports']
assume pay debt obligation incur aid insurrection rebellion united states,['news_&_social_concern']
reason like titan point ja guy real class act,['sports']
puerto rico earthquake aftershock rattle coastline resident deal disaster disaster,['news_&_social_concern']
wonder curse vehement dismissal titans chance point jinx raven tenvsbal,['sports']
yooooo play right national television titan vs raven game go commercial,['celebrity_&_pop_culture' 'music' 'sports']
receive award excellence journalism coverage earthquake puerto rico,['news_&_social_concern']
deadly storm sweep southern united states leave dead npr,['news_&_social_concern']
gen fall storm tonight win goal gen thursday road cougar,['sports']
puerto rico prayer getting hit major earthquake week long include today don scare prepare,['news_&_social_concern']
crookedlyingracist comrade president sta war iran political survival,['news_&_social_concern']
state air embroider,['arts_&_culture' 'fashion_&_style' 'other_hobbies']
glad hammer titan win tonight big bank account thank,['sports']
coach time big bro le geant catalogue sense united states america,['sports']
cnn brice laine iran missile strike manage pinpoint american section iraqi base troop safe iran tell iraq tell united states,['news_&_social_concern']
boy love helpmyhouseishaunte investigator great united states bit hard watch sure miss episode,['celebrity_&_pop_culture' 'film_tv_&_video' 'news_&_social_concern']
nickolay mladenov middle east peace process talk great candid interview believe solution need sta fresh forget past well future,['news_&_social_concern']
draw draft measure completely mix good small town restaurant state,['arts_&_culture' 'food_&_dining']
think good titan texan chief represent afc super bowl year ps city,['sports']
wpi united states daily story aag aag,['news_&_social_concern']
house panel discuss ofw repatriation amid middle east tension politikonew representative,['news_&_social_concern']
united states congress save american wine job sign petition,['business_&_entrepreneurs' 'news_&_social_concern']
note bay good running game sign draft rb offseason congrat titans fan make far,['sports']
situation middle east muddy investor favourite indicator yield curve tell expect,['business_&_entrepreneurs' 'news_&_social_concern']
exclusive secret yacht summit realign middle east east,['news_&_social_concern']
shady bad pre history illegal turn military mercenary army saudi bank resign rep justin amash blast trump sell american troop saudi,['news_&_social_concern']
listen rey girl oakland urban alliance ent united states indiesound newmusic nowplaying indiesound,['arts_&_culture' 'music']
putin say nord stream gas pipeline europe complete end year quarter wall street,['business_&_entrepreneurs' 'news_&_social_concern']
bruce reidel meeting sultan qaboo year remember oman sultan qaboo critical interlocutor middle east brooking,['news_&_social_concern']
wake titans beat break raven wow know extremely happy girl congrat bring good vibe tiger monday night,['sports']
thread yate clear trump openly flaunt operate military mercenary force hrice tag life american soldier know trump forget obscenely,['news_&_social_concern']
try small pa huge effo help affect continuous earthquake puerto rico sponsor like recognize pa relief,['news_&_social_concern']
puerto rico hit earthquake follow day powerful quake,['news_&_social_concern']
candidate run president united states don want know look sundaymorne sundaythought andrewyang,['news_&_social_concern']
remember derrick henry declare draft say tall good run slow,['sports']
direct flight kc saturday sell reason root texans say haven kc future farmer america convention glad thrive breed beef cattle,['sports' 'travel_&_adventure']
francisco seed people doubt dominate viking advance host nfc championship wake today great titans suddenly smh allgasnobrake faithful,['sports']
wonder economic guest appear morning fail mention long dependent oil middle east bc producer oil frustrating,['business_&_entrepreneurs' 'news_&_social_concern']
dear cheer city victory today want super bowl texans titan thank,['sports']
glad thing work dolphin fan hop titans train titanup onceadolphinalwaysadolphin finsup,['sports']
new abc news ipsos poll total democrat republicans concerned somewhat concerned possibility enter war middle east,['news_&_social_concern']
iran late gen soleimani cultivate shiite militia base model hezbollah fill power vacuum syria lebanon iraq yemen write middle east expe wall street,['news_&_social_concern']
good resource share lawyer persian farsi version know right handbook deal law enforcement,['news_&_social_concern']
speak jearlyn steele talk talk book signature wound untold story military mental health crisis tonight pm sure tune,['fitness_&_health' 'news_&_social_concern']
texans head second quarter go locker room chief lead team difference course entire game half nfl nflplayoff houvskc wearetexans chiefskingdom,['sports']
hotel cheer texans way salty cardinal fan want watson watson bust draft wearetexans clemson clemsonfb cfp lsuvsclem,['sports']
texans team nfl history point quarter trail halftime houvskc,['sports']
public want war iran senate reaffirm iran,['news_&_social_concern']
president united states say citizen live puerto rico smh unbelievable,['news_&_social_concern']
right eff take new meaning light recent event middle east hope play live tuesday san jose,['music' 'news_&_social_concern']
seavsgb td pass devante adam give bay lead leave quarter green bay nflplayoff,['sports']
vote primary win wisconsin time vote primary november win presidency united states joy,['news_&_social_concern']
military provocation continue unabated preparation war iran threaten engulf entire middle east planet intensify,['news_&_social_concern']
omg afc divisional game way composure city quarter win outstanding football record believe way guy,['sports']
good discussion development middle east turkish foreign minister cavusoglu today,['news_&_social_concern']
impotus impeach president donald trump history book couldn fitting legacy corrupt president history united states,['news_&_social_concern']
cowboy mike mccarthy texans need new coach hope texans firebillobrien bobsuck,['sports']
need bad boy life huh,['film_tv_&_video']
congratulation awesome fight round,['fitness_&_health' 'sports']
cowboy ml fight tonight,['sports']
love like wind feel nicholas spark pushawardsmaharrrr fumiyasankai,['relationships']
watch chuck terry etim round rigor mortis set half way knockout ufc,['sports']
mma vs link ufc mcgregor vs cowboy live stream free date saturday january mcgregorcerrone ufc cerronemcgregor mma boxing live stream free online fighting,['sports']
finally watch aaron hernandez documentary,['film_tv_&_video']
ufc fight submit train look like norm,['sports']
example boston bad journalism stupidity aaron hernandez documentary netflix,['film_tv_&_video' 'sports']
notorious iron cowboy cheer killer inside aaron hernandez athlete docu kick watch thank,['film_tv_&_video' 'sports']
join rip sin city night bring live coverage mcgregor vs cowboy ufc live fight update result,['film_tv_&_video' 'fitness_&_health' 'sports']
fall grace phenomenal amazing job,['celebrity_&_pop_culture' 'film_tv_&_video' 'relationships']
king knock cowboy second wow ufc thenotoriousmma,['sports']
need watch pa series aaron hernandez feel like question end,['film_tv_&_video' 'sports']
sign conor vs allllllll day get irish dragon elbow,['sports']
pat lose round mahome go run conor mcgregor treat,['fitness_&_health' 'sports']
tale mystery imagination rare arrest illustration edgar allan poe sho story irish stain glass book artist harry clarke,['arts_&_culture' 'diaries_&_daily_life']
new song kick round revteam video hey singe background check,['celebrity_&_pop_culture' 'music']
sinner rightly shouldn compare previous nextgen winner article state harris round opponent incorrect list play purcell website,['sports']
avn week hasn start lifestyle couple town mcgregor fight ask bbc tonight wya bro,['celebrity_&_pop_culture' 'fashion_&_style' 'film_tv_&_video' 'sports']
netflix aaron hernandez documentary finally talk sexuality,['celebrity_&_pop_culture' 'film_tv_&_video']
bad boy life good wanna,['film_tv_&_video']
conor mcgregor stop donald cerrone head kick punch second round ufc las vegas associated,['sports']
french island cfa believe saturday blaze start lightning strike wednesday probably smoulder day wind swing east climateemergency,['news_&_social_concern']
people jump bandwagon one slag get beat suppo defeat suppo victorious champ mcgregorcowboy ufc,['sports']
world pay million watch connor mcgregor fight peacock real fighter lady driller dance thriller keyboard twitter killer steeeeevveee steeeeeel,['celebrity_&_pop_culture' 'sports']
love football hard love watching aaron hernandez doc make feel complicit,['celebrity_&_pop_culture' 'film_tv_&_video' 'sports']
lmao question fall grace,['celebrity_&_pop_culture' 'film_tv_&_video']
try record video fight tonight halfway buddy leave step place go pretty video afternoon,['film_tv_&_video' 'sports']
totally freak work ufc fight night see tv idea see lot people,['film_tv_&_video' 'sports']
biblical lament expression anguish wrecked state world way cry debris death disease injustice oppression scale mound howl wind long lord surprise paradox,['news_&_social_concern']
true crime doco need watch killer inside mind aaron hernandez incredible go netflix see,['film_tv_&_video']
rock onscreen begin bad boy life come officially start wednesday,['film_tv_&_video']
theory fall grace target audience like movie like wait,['celebrity_&_pop_culture' 'film_tv_&_video']
send lot luck girl new zealand round nation cup dousproud hertssquad,['sports']
bad boy life good dolittle dud box office,['film_tv_&_video']
match day live liverpool vs man united come go to good time irish corner limit,['sports']
ufc conor mcgregor knock cowboy round york post,['news_&_social_concern' 'sports']
gig horizon thequeestreetbrewhouse ithelusionist ironduke free entry bloodstockopenair metalthemasse hitchin metal masse round come metal metalessex bloodstock,['music']
australia fire cause bad forestry arson global warming,['news_&_social_concern' 'science_&_technology']
fall asleep wake find defeat cowboy doubt ufc,['celebrity_&_pop_culture' 'sports']
live est scandal aaron hernandez doc est est conference championship pick tune,['film_tv_&_video' 'sports']
fall grace think bomb af disappoint,['celebrity_&_pop_culture' 'film_tv_&_video']
new album people don think mumble rap love year old fax,['celebrity_&_pop_culture' 'music']
soooo official drop point game new album,['celebrity_&_pop_culture' 'music']
go break round match rafael nadal quarter bracket good bet tennis dfs lineup able australianopen atp tennis dfs,['sports']
final score tice south africa win sta olympc year irish woman,['sports']
bad boy life gross estimated weekend represent nd large january debut time weekend estimate badboysforlife badboys boxoffice,['film_tv_&_video']
bad boy life win box office huge holiday weekend badboysforlife badboy,['film_tv_&_video']
like rugby beat pretty irish team year,['sports']
box office bad boy life zoom dolittle bomb hollywood,['film_tv_&_video']
irish assassin man machine ufc,['sports']
absolutely love see humble amazing cowboy amazing post fight interview,['sports']
bad boy life great worldwide dolittle dud global box office update,['film_tv_&_video']
check add closet poshmark free people catch wind ski size nwt shopmycloset,['diaries_&_daily_life' 'fashion_&_style']
bad boy life take offshore bow race global jumanji level up game past ww international box office,['arts_&_culture' 'business_&_entrepreneurs' 'film_tv_&_video']
fall grace edge bed end definitely good watch,"['arts_&_culture' 'celebrity_&_pop_culture' 'diaries_&_daily_life'
 'film_tv_&_video']"
film money bad boy life take offshore bow race global jumanji level up game past ww international box office,['arts_&_culture' 'business_&_entrepreneurs' 'film_tv_&_video']
dumb think album drop not go decent fire,['arts_&_culture' 'celebrity_&_pop_culture' 'diaries_&_daily_life' 'music']
uk watch probably good film see genius fall grace incredible recommend watch afallfromgrace,"['arts_&_culture' 'celebrity_&_pop_culture' 'diaries_&_daily_life'
 'film_tv_&_video']"
game decade bruins stun maple leafs game round,['sports']
write plan week write sho story jarka secondary character wind reader central character sequel wysman come find sho story hard write let thing writingcommunity,['arts_&_culture' 'diaries_&_daily_life']
box office bad boy life cross million worldwide,['arts_&_culture' 'business_&_entrepreneurs' 'film_tv_&_video']
aaron hernandez documentary insane gear antonio brown law order episode drop year aaronhernadez,"['celebrity_&_pop_culture' 'diaries_&_daily_life' 'film_tv_&_video'
 'sports']"
fall grace netflix soooo good deliver good film,"['arts_&_culture' 'celebrity_&_pop_culture' 'diaries_&_daily_life'
 'film_tv_&_video']"
great netflix film suggestion irish time bit disappointed breathe normally wasn mention twilight,['arts_&_culture' 'diaries_&_daily_life' 'film_tv_&_video']
great end round racing time recover thank rupholde fun wc drink ortnerhof,['diaries_&_daily_life' 'sports']
great job team aaron hernandez documentary fascinating,['arts_&_culture' 'diaries_&_daily_life' 'film_tv_&_video' 'sports']
np radio blue wednesday ft magnus klausen wind,['arts_&_culture' 'music']
bad boy life expect cross million mark holiday weekend gemini man film film badboysforlife,"['arts_&_culture' 'business_&_entrepreneurs' 'celebrity_&_pop_culture'
 'film_tv_&_video']"
fall grace wow def makin perfect,['arts_&_culture' 'diaries_&_daily_life' 'film_tv_&_video']
irish win big trotwood final score finish point dominant second half,['sports']
round pick mahome,['sports']
akron svsm trotwood madison final malaki branham irish ramar pryor marcus johnson chip sammy anderson lead ram,['sports']
fall grace listen,['arts_&_culture' 'celebrity_&_pop_culture' 'film_tv_&_video']
say watch aaron hernandez documentary netflix check wow pretty good,['diaries_&_daily_life' 'film_tv_&_video' 'sports']
talk mcgregor fight dad brody dad easily second corn head fall face knock guess wrong,['diaries_&_daily_life' 'family' 'sports']
day release album day global warming end,['arts_&_culture' 'celebrity_&_pop_culture' 'music']
