text,label_name
beat rapid game western division final evan edwards hit hr wp josh roberson ip bb mwlplayoff mwlscoreboard,['sports']
hear eli gold announce auburn game dumbass,['sports']
phone away try look home game ticket october,['sports']
year ago louisville struggle beat fcs opponent isu yes win score indicative game flow today demoralize well fcs opponent eku thank glad go,['sports']
know dodger oriole game thursday fox arguably game entire schedule imagine fox,['sports']
care give shot struggle joey offer game decide want start mississippi state game gus,['sports']
okay watch state unlv game fb,['sports']
check large crowd basketball game phil arena aim set new attendance record fiba world cup final target fiba allow sro incredible philippine sport,['sports']
vote wewantncaafootball good video game,['gaming' 'sports']
stream new game minionmaster come stop join fearthepack supportsmallstreamer smallstreamersconnect smallstreamer twitchaffiliate twitch twitchprime subtember,['gaming']
unanswered goal tie game manncup,['sports']
shout give year old son wrist ban game mean world sleep school monday old brother jealous,['sports']
little voice leave completely exhausted change world exciting broadcaster game win play time expire tonight second time call gw fg monumental win georgetown,['sports']
great win yesterday stay go game season great callum bennett impressive home especially youth step earlswoodcc cricket,['sports']
refreshing twitter hard right gopher game atawedde,['sports']
raginggirlgamer feature binxtv visit twitch stream earn binxcoin chance win free steam game,['gaming']
late victim madden curse cover game career turn bad,['gaming' 'sports']
game win well handle need handle completion good win match let play final hope build season maguire believe possible nrltigersshark,['sports']
dback mark mediocrity month hot team game right tonight emergency episode answer question pose new one tune,['sports']
wonder stay washington cal game pacinthedark,['sports']
tuber simulator good mobile game ok,['gaming']
season fixture vs pre season game morning win week hopefully good pre season result ahead new season silly mistake week coyb,['sports']
leave theme song change song joe version power,['celebrity_&_pop_culture' 'music']
steven hope catch fury game college baseball end enjoy watch play season grandson nate heap praise,['sports']
prime minister take game brexit bluff dublin tomorrow seemingly unconcerned mendacity visible write vice lead johnson useless come wield power,['news_&_social_concern']
game win black swan fastandfree,['sports']
wellington cowboy time cowboy win group grade title performance worthy occasion cowboy down minor premier dubbo cyms spark emotional celebration,['sports']
tunisia win second classification game angola mean dtiger win host china classification game pm today ball run believe guy,['sports']
game finish goal scorer,['sports']
enjoy review chapter mention screenwriter gary dauberman theresareasontheydontjustfilmthebook noscriptnofilm itstartsonthepage creditscreenwriter,['arts_&_culture' 'film_tv_&_video']
able play game currently pay stream service stream game wish,['sports']
game day good luck tonight augsburg wish wearegiant,['sports']
enjoy game result want good unlucky fight,['sports']
check smurfs race smurf village game pressmantoy,['gaming' 'other_hobbies']
day saveagainstfear session run safe deadland join like usual party people home game deal train heist blast invite join home game,['gaming' 'sports']
game day wish suit today rest well soon hope hear cheer wny bringit gobill,['sports']
game day nfl inbrotherhood riseup atlantafalcon nflkickoff mercedes benz stadium,['sports']
baker mayfield obj arrive game firstenergy,['celebrity_&_pop_culture' 'sports']
time bite happyness game start demo today palm beach gardens come happylicious bitesofhappyness demoday groceryshoppe palmbeachgarden,['food_&_dining' 'sports']
great game college career look forward season,['sports']
game ai live come listen deconstruct gameai gamedev,['gaming' 'sports']
volunteer lawn sign campaign think look like tee shirt picture need original artwork possibility,['news_&_social_concern']
believe officiating let game completely away utter disgrace hold accountable,['sports']
week book rest usa tom stewart game recap goowl intellectualbrutality,['sports']
photo woman final game salo floorball salibandy,['sports']
flyeaglesfly entire offseason plus camp prepare st game season sad,['sports']
look flat th preseason game,['sports']
wake case see postgame column ve get stat red zone cal past season seriously,['sports']
keep go lose game penalty min play,['sports']
power cbs production truck kc jax game good chief,['film_tv_&_video' 'news_&_social_concern' 'sports']
sunday xi dec winslet mason over draw sunday xi over final game season sunday vs welcome hcg autumn,['sports']
consider allow overage player team game idea coach game today,['sports']
enter chance win alienware remnant ashe bundle giveaway alienwaregiveaway,['gaming' 'science_&_technology']
game night confe vs royalsrule win groab,['sports']
hope let like prior year let team giant come score right field score game wedemboyz,['sports']
new tagging game idk reply emoji question uwu,['gaming' 'other_hobbies']
quick tweet result brewer cub series game today september expect outcome happen,['sports']
like remember kid year ago make incredible catch save game,['sports']
watch lec guy think win today cg reverse sweep cody sun quadra close game confuse tomato gif right track,['sports']
awesome win score goal fresh triston key hard fight match colt great game gocoug breakthestreak,['sports']
brady roethlisberger movie obviously chris pratt tom struggle play ben,['celebrity_&_pop_culture' 'film_tv_&_video' 'sports']
clean numbani playoff game iconic duo everupward owl,['sports']
drinking game snfonnbc tonight drink time talk screen,['gaming' 'sports']
want play gopoke pull ben bad half game know lose steelersvspatriot,['sports']
st margaret pm game canon mac forwards migliozzi felse robb gollob freeman cessna lutz defense strilka muha zulka goalie malley,['sports']
hunch circumstantial evidence allegedly attempt sway titansvsbrowns game yesterday nfl enter sketchy territory get come,['sports']
sep softbank hawk vs lotte marines game highlight yahoo dome npb,['sports']
big mismatch tonight denvsoak game thought action game analysis,['sports']
raven vs dolphin post game breakdown,['gaming' 'sports']
devs truly outdo chapter regret single second play amazing experience game,['gaming' 'sports']
update scoreboard non conference september home game night games lsu non conference september home game night games lsu game mcneese state kickoff schedule cancel weather,['gaming' 'sports']
final jv vs good game girl,['gaming' 'sports']
groom halftime performance raider game saint game bts pic styling stunt drive genesishalftimeshow espn,['celebrity_&_pop_culture' 'gaming' 'music' 'sports']
super game orleans win thriller saintsgameday texansvssaint,['gaming' 'sports']
soccer girl varsity game westford academy vs wayland high school westford academy trustee field dcl girl soccer,['gaming' 'sports']
fixk hire devs nba year beta game star game company put trash year,['gaming' 'sports']
boom game day varsity boy girl soccer ditch vs pick north game times girls boy pawsitivity tigerssoccer,['gaming' 'sports']
great read great pic boot season point hit game sunday vs white goal rest season angeles,['news_&_social_concern' 'sports']
know huuuge long shot see game capcomvssnk song terry true love make ll prolly hear different song game smashbro,['celebrity_&_pop_culture' 'gaming' 'music' 'sports']
game preview week pennstate vs pitt michiganstate vs arizonastate purdue vs tcu good stuff,['gaming' 'sports']
girard indians vs john kennedy eagle,['sports']
new podcast break dolphin game talk cardinal call crawford chronicle,['sports']
friday game vs air live network exclusively catch special encore presentation saturday pm apple,['gaming' 'sports']
check olathe north vs lawrence free state game highlight sept olathe north high school varsity volleyball hudl,['gaming' 'sports']
want original charm come marie combs streghe ilpoteredeltriocoincidecolmio thepowerofthreewillsetusfree,['celebrity_&_pop_culture' 'film_tv_&_video' 'sports']
understand recent steam saint yes good at road bree goff home road split favor ram sho week saint emotional mnf game public love saint watch,['sports']
isn sport rugby show toulouse vs city match weekend think show playoff match,['gaming' 'sports']
ok muscular injury real madrid time na federico valverde hin miss tomorrow game ucl opener vs psg everybody kukuma injury,['gaming' 'sports']
sept vs quarterfinal action leg game repo,['gaming' 'sports']
game tournament go point point umw vs columbia start minute,['gaming' 'sports']
game area grandview height man follow follow arcadia final game sure ll tfhss,['gaming' 'sports']
cardinal field cross town rivalry game leuzinger olympians go to great night lawndalerockstar lawndalecardinalfamily togetherwewin cifssfootball,['gaming' 'sports']
game day team action week st vs pm kick reserve vs reserve pm kick rd vs rds pm kick good luck team ut,['gaming' 'sports']
ohio state indiana pick today,['sports']
halewood lion vs msb sounder tomorrow academy leather lane look forward game,['gaming' 'sports']
footballer watch teammate stroke way game teach player cpr,['fitness_&_health' 'gaming' 'news_&_social_concern' 'sports']
think buffalo expect physical game force today letsfly afvscu,['gaming' 'sports']
college football saturday athletic punch close temple won boy unsatisfying,['gaming' 'sports']
elimination game vs catch live pm de ready world sundayfooty,['gaming' 'sports']
minnesota viking vs green bay packer prediction handicapping preview vegas gopackgo skol,['gaming' 'sports']
announce attendance vs tonight large crowd history nny,['sports']
battle night vs roc body night vs shine physical battle night vs cal performance night body bag,['sports']
love minute vs definitely favorite pro wrestling match ve see life bloodsport,['sports']
tyson fury otto wallin sta time live stream fight prediction date card odd preview tyson fury boxing otto wallin deontay wilder,['sports']
cowboy release chris covington texans try,['sports']
new traffic rule public vs police rajmohal bhubaneswar odisha white color crime wl increase govt release innocent woman,['news_&_social_concern']
know preseason take tomorrow preseason game golden vs mobile,['sports']
check add closet poshmark vs black white cami shopmycloset,['fashion_&_style']
check game recap madison academy brewer,['sports']
philadelphia eagle vs atlanta falcon prediction handicapping preview vegas inbrotherhood flyeaglesfly,['sports']
halftime nationally mater dei st frances academy,['sports']
fantastic game girl yesterday great adve girl football present county thank ryman bring colebrook girl sure regular fixture vs,['sports']
ind vs sa september pm ist,['sports']
want example big sport dhoni quote dhoni retire injure rest dare utter word drop,['celebrity_&_pop_culture' 'sports']
leader trophy st round st leg vs re,['sports']
game day vs oxleathersfc div sponsor roebuck draycott clay lower abbot bromley school cmonthestag,['sports']
season food schedule far wk vs miami cuban sandwich thank wk vs arizona chicken chimichangas choc banana chimichangas wk vs kansas slow cook bbq rib wk vs cleveland pull pork wk vs pittsburgh pierogie primanti sandwich,['food_&_dining' 'sports']
indvssa heavy downpour dharamsala ahead,['news_&_social_concern' 'sports']
check add closet poshmark nic zoe size xl dress dark brown knit fit flare shopmycloset,['fashion_&_style']
lion cub escape mother witness king cobra spray cpatecmwitt lion vs king cobra lion cub escape snake hunting return,['film_tv_&_video']
st good walthamstow bournemouth local resident try contact office twice phone time office door plus today second meeting let know good,['diaries_&_daily_life' 'relationships']
matchup philadelphia eagle vs atlanta falcon comment think win tonight sunday night game fun bfitathletic stancesock sock sockgame,['sports']
round vs nbatwitter,['sports']
sooooo stillchase vs yesssssss,['sports']
match cwc challenge league tomorrow morning host cest match centre extra update feed follow match centre team toss weather dkcricket,['sports']
vanillalace vs dupe pink himalayan sea salt argan hemp organic handmade luxury soap cake bestselle vegan soapa mother day soap,['business_&_entrepreneurs']
icymi state ku history weekend ku end road losing streak power team ksu beat sec team regular season time time team win road non con game week year,['sports']
check add closet poshmark vs uplift demi bra shopmycloset,['fashion_&_style']
second leave half vs angeles flag punt return save detroit fumble tragedy special team issue,['sports']
lightweight fight need ufcvancouver vs vs vs,['sports']
point person need trade stephen ross trade good player game team suck real hard fan hard rock stadium right go dolphin,['sports']
switch raven vs chiefs sunday night week,['sports']
wow vito goal rusnak times surely lose footing bad luck salt vs united mnufc minvrsl coyl,['sports']
know game today know give run game vs know ufc fight clubhouse whew let walk plank review week letsgobuc,['sports']
msoc time pilot hit pitch wisconsin tune live update gopilot wisconsin madison wis mcclimon soccer complex pm pacific,['sports']
antonio brown debut dominant defensive effo gostkowski beat heat recap patriot win dolphin watch,['sports']
champion vs championship cause,['gaming' 'sports']
uk govt end single crewing roll taser police officer sign petition org,['news_&_social_concern']
live chief rewind week raider chiefskingdom,['sports']
msoc final shaw bear return mac wednesday sept,['sports']
tear gas water cannon brick molotov cocktail thousand defy protest ban hong kong island,['news_&_social_concern']
stream live ralpup cup vs gumbawlz,['gaming' 'sports']
match woman tag team championship vs wweclash,['sports']
djeff vs projeto kaya beija flor music video youtube projetokaya wdbmanagement kazukutarecord,['celebrity_&_pop_culture' 'film_tv_&_video' 'music']
lose vs excited play ec boy gg,['gaming' 'sports']
lose vs ecs fun playing boy look forward future match,['gaming' 'sports']
new york giants daniel jones week starter vs tampa bay bucs eli manning go bench,['sports']
premier county semi final vs thursday th patrick park enniscorthy suppo need upthebutter,['sports']
join gitex technology week october th th dubai world trade center uae great technology gitex,['business_&_entrepreneurs' 'science_&_technology']
confidential memorandum date aug office president order suspension negotiation signing loan grant agreement country vote favor unhrc resolution july,['news_&_social_concern']
look ahead sunday daniel jones debut bucs defensive coordinator todd bowle vs rookie quarterback coordinator head coach stat nyj nyj ari phi,['sports']
ebfl division match highlight watch extend highlight game sandhurst townmead match footage film allaboard htfc watch,['sports']
check rare wayne gretzky th annual burlington horseshoe program mint,['sports']
look shootout scoreless win houghton sta play greatdaytobeahawk goal wheeler gagnon singer osborne save,['gaming' 'sports']
ray th red sox indians th stay hottt,['sports']
way watch past episode mel robbin cc miss entire week catch episode youtube find way episode fire tv thank advance,['celebrity_&_pop_culture' 'film_tv_&_video']
legal expert predict ivanka trump indict fraud charge new york entire trump family criminal enterprise,['news_&_social_concern']
slip away official music video dr ross henderson save dog tiki blue healer nice knowledgeable intensive caring humble person need vet service year dr ross good see,['celebrity_&_pop_culture' 'film_tv_&_video' 'music']
enjoy dark mode greatly appreciate,['science_&_technology']
await bigil audio launch day nanbas today pm telecast nanbas time free watch video bigil audio launch begin till end surprise thing wait nanbas bigilaudiolaunchonsuntv bigil,['film_tv_&_video' 'music']
okay congratulation sell entire festival mf money ball court excited upcoming year,['arts_&_culture' 'music']
hinahanap ko na yong bonggang selfie nyo boy shout ayeeeeee asapsundatewith boybandph,['music']
climate change protest today uk pa global strike,['news_&_social_concern']
giorgio armani take languid leisurely bow courtyard private palazzo earthily asia influence collection rule red carpet bio review,['celebrity_&_pop_culture' 'fashion_&_style']
try different tactic year basically run exact time second slow year personal good skill yep complete th half marathon please swindonhalf,['fitness_&_health']
come freak mouth blatantly false watch jerry nadler climate change great threat world war,['news_&_social_concern']
stall drive red zone prove costly night arkansas state learn siu backup qb rb javon williams jr real deal,['sports']
quinnipiac field hockey take vermont conference matchup afternoon fall sho time uconn game,['sports']
week world leader convene new york general assembly climate change iran venezuela rundown issue,['news_&_social_concern']
family man tv series overwhelm watch act dhriti acting worth talk neeraj madav good complete season guy kudo,['celebrity_&_pop_culture' 'film_tv_&_video']
personalize field hockey keychain field hockey gift,['fashion_&_style' 'sports']
climate change trend big sexy issue constant problem,['news_&_social_concern' 'science_&_technology']
night huge thank entire ucla crew good business thank tune send message absolute blast highlight game remember,['business_&_entrepreneurs' 'sports']
miss recent blog reveal testing tool use threat stack ensure secure code deploy piece,['science_&_technology']
clean sheet mark th league sta club move th time ahead hezzy hvfc,['sports']
slapper alert cupcakke crazy story remix official music video,['film_tv_&_video' 'music']
request release audio launch event youtube huge request fan bigilaudiolaunchonsuntv bigil,['film_tv_&_video' 'music']
think harbaugh listen friday figure go th option beat chief,['sports']
spend entire day watch youtube video literally single lmao vlog performance etc channel,['film_tv_&_video']
watch patriot game desktop computer chief game laptop watch steven universe tv,['film_tv_&_video' 'gaming' 'sports']
climate change arctic glacier shrink year itstimetochange climatechange join,['news_&_social_concern' 'science_&_technology']
great road win today boyzzz let home chief hope okay prayer onepride,['sports']
radiohead thom yorke admit climate change hypocrite,['news_&_social_concern']
great aussie world lead business step issue define future cannon climate change get plan play future demand,['business_&_entrepreneurs' 'news_&_social_concern']
cry entire half evan hit remember anxious kid high school feel like live try kill time reason completely well get,['learning_&_educational' 'youth_&_student_life']
carrum down man lucky alive car plough living room second get couch use toilet,['diaries_&_daily_life' 'news_&_social_concern']
thing know like freddie kitchen freddie new head coach hasn find way young qb struggle defense well deserve prediction season look good win super bowl soon,['food_&_dining' 'sports']
hot temperature record month year new york daniel jones giants jet,['news_&_social_concern' 'science_&_technology']
listen grow year graduate highschool year graduate th grade emotional trip,['learning_&_educational' 'youth_&_student_life']
climatechange accelerate accord new un repo climatecrisis auspol lnpfail,['news_&_social_concern']
climate change midst hot year record nextafrica nmgat kusiideasfestival medium,['news_&_social_concern']
jp sottile empire climate change jon gold bill barr justice spreaker,['news_&_social_concern']
gammon pen letter student protest climate change mail,['learning_&_educational' 'news_&_social_concern' 'youth_&_student_life']
dark mode work color system,['science_&_technology']
japan new environment minister shinjiro koizumi pledge sunday mobilise young people push coal dependent country low carbon future make fight climate change sexy fun,['news_&_social_concern']
report rise climate change awareness poll find people say limit air travel reduce impact climate lorraine director welcome result,['news_&_social_concern' 'travel_&_adventure']
zuckerberg ex mentor roger mcnamee similr big challenge tackle climate change platform allow denier disproportionate influence deny freedom speech deny amplification,['news_&_social_concern']
join live day lab labour environment upland national park climate change support nature fringe event feature,['film_tv_&_video' 'news_&_social_concern']
new music video yam repass link hoodie season iii come godovermoney hogmobministrie dafixxradioshow pray artsoulradio prayforhiphop,['film_tv_&_video' 'music']
macgeekstip learn turn dark mode,['science_&_technology']
newmemoriesintro official music video brand new single watch newmemoriesoutnow,['film_tv_&_video' 'music']
climate change protestor shut street increase carbon emission trend,['news_&_social_concern']
liberal abstain have child save world climate change aag,['news_&_social_concern']
sure need hear climate change real human being cause accelerate alaska sea ice completely melt away,['news_&_social_concern']
goodread knowledge power medium coverage climate change fact,['news_&_social_concern']
bbc news greta thunberg leader fail climate change,['film_tv_&_video' 'news_&_social_concern']
great highlight article friday climate change rally march great experience student learn mondaymotivation,['learning_&_educational' 'news_&_social_concern' 'youth_&_student_life']
climate change access care period common woman monday join goalshouse share put woman change healthforall global,['news_&_social_concern']
inspirational address pm climate change president make unscheduled entry summit proud moment indians howdymodi,['news_&_social_concern' 'relationships']
ac client education technology company dedicate create solution improve education launch climate action kit empower student tackle climate change issue,['learning_&_educational' 'science_&_technology' 'youth_&_student_life']
new video op feat abg neal come wshh exclusive official music video,['celebrity_&_pop_culture' 'film_tv_&_video' 'music']
state show willingness lead clean renewable energy stop write editorial call lawmaker ceja pa veto session agenda,['news_&_social_concern' 'science_&_technology']
wonder like ilk know footnote history pa generation think away denialist conservatism pretend climate change didn exist auspol,['news_&_social_concern' 'science_&_technology']
climate change day peep cue good trump bad trump definitely good trump pastor praise trump skip un panel imaginary climate crisis real problem religious persecution foxnew,['news_&_social_concern' 'science_&_technology']
check play alexandernoice year october th bluewhalemusic angelcityjazzfestival lamusic losangele,['music']
know hell happen country president today climate change,['news_&_social_concern' 'science_&_technology']
thestory millennial protest climate change need spend time study science cutting class protest foxnew cnn msnbc,['film_tv_&_video' 'news_&_social_concern' 'science_&_technology']
go announce week know personal affair come year comic artist residence oulu comic_strip center liminka school art finland honored select,['arts_&_culture' 'youth_&_student_life']
late daily dose beauty thank togetherwe gostar,['fashion_&_style']
planet literally world leader revolutionary captain planet go public eye call politician bs hope succeed quest help people aware climate change,['news_&_social_concern' 'science_&_technology']
love stay calgary hope win hoang cm stay dine giveaway hotel year round outdoor heated pool bunch restaurant nice room great hotel capturecalgary adventure yyc explorealberta,['food_&_dining' 'travel_&_adventure']
time talk act climate change modi time,['news_&_social_concern' 'science_&_technology']
greta thunberg steal childhood com,['news_&_social_concern' 'relationships']
dare greta thunberg passionate cry climate action,['news_&_social_concern' 'science_&_technology']
frog decline world pakistan pollution loss habitat climate change poach medical lab contribute decline aren frog protect law law protect,['news_&_social_concern' 'science_&_technology']
greta thunberg ally file climate complaint country china sad little girl globalist mature angry think,['news_&_social_concern' 'science_&_technology']
wish people stop watch fox news help create false narrative climate change jeopardize life extinction climatecrisis climatestrike daily,['news_&_social_concern' 'science_&_technology']
stephanie van hook cope find strength climate change,['news_&_social_concern' 'science_&_technology']
reboot earth project vistara aim educate woman rural area climate change firstpost womenintech cc,"['film_tv_&_video' 'learning_&_educational' 'news_&_social_concern'
 'science_&_technology']"
climate change confession drive diesel pickup truck steak pound plastic straw despite want hundred plastic shopping bag btw guy huge sec fine get,['news_&_social_concern' 'science_&_technology']
sorry feel like disturb life fact clean state business consumer polluter don believe climate change suggest learn read,['news_&_social_concern' 'other_hobbies']
heat island recur phenomenon climate change fight discover solution propose winner infrastructure award greensolution awards climatechange climateaction unga,['news_&_social_concern' 'science_&_technology']
week member pro weekly chart include dance club song chart sorry folk news chart need know entire cha week member bb pro link,['arts_&_culture' 'music']
group stage final tour option budget come suppo world year booking open tworldcup icc,['sports']
