text,label_name
sure fright disney espanto tick tick write helpless expect bunch drunk girl gay singe peddle pub,['film_tv_&_video']
major quantum computational breakthrough shake physics math different description quantum phenomenon expect mathematically equivalent new paper show,['learning_&_educational' 'news_&_social_concern' 'science_&_technology']
carmelo anthony say damian lillard good player play high praise melo,['celebrity_&_pop_culture' 'sports']
streaming type program streaming program stream app don let pick song app pick song deezer flow free pandora free livexlive stream app count hot,['film_tv_&_video' 'music']
dear digital commendable app check come datum photo think need rectify process complete thank joe,['diaries_&_daily_life' 'other_hobbies' 'science_&_technology']
expect come anyday unable process fact anymore inspiration decade people start watch match singh middle hope msdhoni,['gaming' 'sports']
christian conversion mafia work feeely rule change demography india village expect bjp noconversion prakash surendra,['celebrity_&_pop_culture' 'news_&_social_concern']
malaysia trend follow insight man city pick junkyu kedah davy yuna ligue germany hawis kirito view google search trend insight,['business_&_entrepreneurs' 'science_&_technology']
ufc co main event omalleyvvera suga good intelligent focused vera good hype suga deserve suga win inside distance,['news_&_social_concern' 'sports']
nigeria trend follow insight orijinalowambe guardiola brighto world cup tolanibaj laycon yakubu tbaj man city ligue view google search trend insight,['sports']
guardiola look find excuse man city exit,['celebrity_&_pop_culture' 'sports']
atinsugg listen party gitz album lead boy sb tweet countless time well week think help hopefully bring hype ssb,['celebrity_&_pop_culture' 'film_tv_&_video' 'music']
minute watch suga fight live hype,['celebrity_&_pop_culture' 'film_tv_&_video' 'sports']
watch live man city lyon uefa champions league quarter final,['film_tv_&_video' 'news_&_social_concern' 'sports']
karanjohar gunjansaxena expect award like padmashri pls understand audience fool high contact gov go help time hope air take right conclusion not demean insult iaf,['celebrity_&_pop_culture' 'diaries_&_daily_life' 'news_&_social_concern']
target passenger day expect achieve time project fully operational,['business_&_entrepreneurs' 'other_hobbies' 'travel_&_adventure']
manchester city tense meeting bayern semi final,['celebrity_&_pop_culture' 'gaming' 'news_&_social_concern' 'sports']
carlyon stake likely field saturday valley race brooklyn dunn humma mott stackhouse bon away snitzkraft alfa melham jungle edge fine dane small field expect feature,['celebrity_&_pop_culture' 'sports']
expect typical movie whr start wid bang bt isn tht different good show range emotion cast crew god sake don miss khudahaafiz,['film_tv_&_video' 'news_&_social_concern']
consider retire expect choose join journey unexpected think ve wait year fan wait comeback open miss thankyouraina,['celebrity_&_pop_culture' 'diaries_&_daily_life' 'sports']
bay area fire weather watch heat wave dry lightning sanjosecommunity sanjose siliconvalley sanjosecommunity siliconvalleycommunity,['film_tv_&_video' 'news_&_social_concern']
hi recharge number gb datum isn show app help,['business_&_entrepreneurs' 'diaries_&_daily_life' 'science_&_technology']
hot day bay area little cool near dillon beach output bodega bay,['news_&_social_concern']
manchester city star laporte criticize var shock lyon loss,['sports']
askawaazcash buy number irctc sell hold hold expect target price time plz,['business_&_entrepreneurs']
hype restart great way improve heal strong wise smarter,['fitness_&_health']
order grocery rs payment return app payment fail jioma app money get debit bank call bank ask ask merchant call respond,['business_&_entrepreneurs']
nowplaye channel miccratesradio download app submit music today,['music']
bitj dreamland bitj dreamland debut album coherent thought bay area rapper bitj dive psyche man deal issue depression vice accept,['celebrity_&_pop_culture' 'music']
halfway ride remarkably slightly schedule mile circuit enjoy tailwind headwind way mind lap training daysnc suppo,['fitness_&_health' 'sports']
love read rant man city pep get wrong chris european domestic winning medal,['sports']
passion pro buy nov troubling single day confidence start hassle start choke service center say expect live,['science_&_technology']
guardiola tinker end familiar champion league exit man city satmusicsport,['sports']
bittersweet possibly today deserve accolade de kevin de bruyne manchester city midfielder name premier league player season,['sports']
approval fda saliva test virus expect sta clia lab come week welcome news thankyouscience school yale rapid saliva test receive fda emergency use authorization,['fitness_&_health' 'news_&_social_concern' 'science_&_technology']
manchester city exit champion league quarterfinal time role question mark pep cv time think ooohh man inexcusable,['sports']
pi new digital currency develop stanford phds million member free pi app follow link use username mrcoinminer pi smartphone airdrop vya old iphone btc xrp,['business_&_entrepreneurs' 'science_&_technology']
tahir ul struggle individual group system expect change poor country justice,['news_&_social_concern']
hermosaflor daisy eyeshadow palette believe hype,['fashion_&_style']
live come stream love twitch pathtoaffiliate smallstreamerconnect warzone streamer twitchstreaming twitch,['gaming' 'news_&_social_concern']
report peace talk afghanistan taliban expect begin soon,['news_&_social_concern']
finish day home fantastic far notwithstanding day ignite yoga far way well expect awesome addition running swimming,['diaries_&_daily_life' 'fitness_&_health']
premier league club submit plan fan return expect capacity palace everton newcastle struggle poss amnesty fan share ticket spur brighton man city want sell pint seat,['sports']
hour min blacklovevirtualconce visit download app playtore io enjoy conce,['music' 'science_&_technology']
late mobile bay area daily thank pbl onlinelearne,['diaries_&_daily_life' 'learning_&_educational' 'news_&_social_concern']
expect come think magnus miscalculating endgame transition like exciting finish set impactchess,['gaming' 'sports']
conservative wrestle kamala identity embody complexity america heritage experience bay area dc student senator york times,['news_&_social_concern']
see great pic point colleague funnel cloud potential waterspout redcliffe bay area portishead bristol channel min ago sort permission tweet image,['news_&_social_concern']
team arrow love suppo watch play guy undead right smallstreamercommunity fallguysgame,['gaming' 'sports']
wake mood listen insustry game chef kiss,['celebrity_&_pop_culture' 'diaries_&_daily_life' 'gaming']
master reading mind send survey like praise reward late love response send survey beepicin keeplaportestrong survey teacherstrong,['learning_&_educational']
anon dear love know dnt know want know think youi find wat resist turn walk away,['other_hobbies' 'relationships']
photo rachel luna getty image today epic game take unfortunate step violate app store guideline apply equally developer design store safe user apple say statement,"['business_&_entrepreneurs' 'gaming' 'news_&_social_concern'
 'science_&_technology']"
teaser foot wet discuss manchester city shock defeat lyon quarterfinal uefa champions league,['sports']
adventure traveler expect resume near pre covid level travel spending grouptour adventuretravel,['news_&_social_concern' 'travel_&_adventure']
united states trend follow insight alex smith mark meadow uspsprotest lgbtqiaoftwitter sundaythought votere thechi skyward sword waffle house bay area view google search trend insight,['news_&_social_concern']
ll find way past tense hit hard timstwitterlisteningparty,['music']
pathetic bias bt see tonight favour manu like man city night let impartial mufc munsev,['sports']
quick end expect blast girl coach teammate life softball memory,['sports']
ll find way silence lyric guy breath take timstwitterlisteningparty,['music']
distance learning plan dlp destroy education base flawed covid figure letter superintendent public school minnesota de,['learning_&_educational' 'news_&_social_concern']
great half football enjoyable excellent expect chance end good fre recover ball williams continue grow mufc,['sports']
yes thank remove fortnite app store,['business_&_entrepreneurs' 'gaming' 'science_&_technology']
nfc south expect competitive division nfl predict team nfc south look,['sports']
new collaboration time way jazz cover didn care ink spot sing amy adam film miss pettigrew live day follow great music,['music']
dummy call playoff game monday night download app free code clipcast watch live broadcast nba clippernation mavs laclipper,['gaming' 'sports']
hope book rotation student distance learning clearthelist magentamagic,['learning_&_educational' 'youth_&_student_life']
local community organization accept laptop necessary tech distance learning thousand child need laptop community reply tweet dm info donation student,['learning_&_educational' 'news_&_social_concern' 'youth_&_student_life']
exclusive tense month wait australian taxation office staff geelong expect tell today ato presence city continue sarah,['news_&_social_concern']
stream kasabian evening hit expect,['celebrity_&_pop_culture' 'music']
like castmate love everybody include dope pvalleystarz,['celebrity_&_pop_culture' 'film_tv_&_video']
tjms distance learning schedule ready rock check video record productivity video whatwedomatter prideofthepack werock thank loom inspiration,['learning_&_educational' 'youth_&_student_life']
youngjae like enter kkt talk ahgase suggest jaebeom time yj talk ahgase feel love good get,['celebrity_&_pop_culture' 'film_tv_&_video']
pep guardiola champions league obsession leave manchester city familiar question answer,['sports']
biden hail mary joe biden expect target evangelical voter week democratic national convention pastor baptist church dallas robe say biden play will sway christian vote trump,['news_&_social_concern']
regardless mother nature delay flight dfw get home hour later expect unknown flight delay policy provide compensation ecb sdf take hour unexcuseable,['diaries_&_daily_life' 'travel_&_adventure']
thought night dnc aplovgov,['news_&_social_concern']
kristin urquiza speech dad die powerful moment dnc night pre existing condition trust donald trump,['fitness_&_health' 'news_&_social_concern']
takeaway dnc night,['news_&_social_concern']
pns daily newscast august michelle obama bernie sander headline night dnc union demand action protective equipment news air,['news_&_social_concern']
key moment democratic national convention night,['news_&_social_concern']
housing start jump higher well expect,['business_&_entrepreneurs' 'news_&_social_concern']
trump morning talk laughable night democratic national convention wimpy republicans dad work border,['news_&_social_concern']
repost night dnc focus unity feature handful republican speaker lady michelle obama tonight democrats continue virtual convention,['news_&_social_concern']
psg state run club champion league final landmark low football cough cough different story man city get final,['sports']
sure senecio pa time class pa time virtual learning place reduce class size bussing need parent kid heave underlie health condition option stay safe explain janice,['learning_&_educational' 'youth_&_student_life']
excited announce work upturned root silverpoint handmade panel select show de young museum thedeyoungopen exhibition feature bay area artist open shortly young reopen,['arts_&_culture']
live chat get view positive feedback expect time tanya phil chat mar identity crisis early space age aug pm edt new identity mar,['science_&_technology']
exclusive wahee abbas uae car win brake suvs expect account cent market reflect change consumer preference go forward insight uae usedcar,['business_&_entrepreneurs' 'news_&_social_concern' 'science_&_technology']
wow turn well expect ptrp stamp ptr basically hk clone put couple store feature sba brace sbtactical,['diaries_&_daily_life' 'science_&_technology']
lineal cham peen way john sullivan put notice showyourself grind box academy fitness center,['fitness_&_health' 'sports']
bay area bad air quality world official tell san francisco diner stay home,['food_&_dining' 'news_&_social_concern']
demon soul close expect recent rating indication jordan devore destructoid gamer game gaming videogame,['gaming']
french side impress champion league worth follow ligue new season get underway weekend use expect goal prediction,['sports']
fianna famous partie show expected return form golfgate,['celebrity_&_pop_culture' 'sports']
bonus episode daily expect give timeline dnc friday episode,['film_tv_&_video']
dead daylight fog dive connection pa connection come sorry upload later expect internet decide didn deserve upload intothefog deadbydaylight fogdive connection,['gaming']
hurricane expect enter gulf mexico early week late expect need watch marco laura closely stay weather aware mswx alwx wcbi,['news_&_social_concern']
boot ground dighton maga chusetts,['news_&_social_concern']
check cabi ski blue white pocket style women size cabi aline casual,['fashion_&_style']
send line mf hit free throw save life,['news_&_social_concern' 'sports']
want single fan cheer matt adam ready burn man cause pache line,['celebrity_&_pop_culture' 'sports']
man angele free throw man need step knock line,['news_&_social_concern' 'sports']
look like joebiden go hit ground run jan maybe right swearing jan,['news_&_social_concern']
check write mouth watering encounter lisbon need champion league final link baypsg psgfcb jay,['sports']
woman charge take maga hat boy outside democratic national convention epoch,['news_&_social_concern']
sir come ground level know condition people save life final year student sir swamyjicanceluniversityexams,"['fitness_&_health' 'learning_&_educational' 'news_&_social_concern'
 'youth_&_student_life']"
charity stream right ve raise trans charity come line,['news_&_social_concern']
know marvel manage actual good howard duck reboot,['celebrity_&_pop_culture' 'film_tv_&_video']
add listing poshmark sonoma braydon grey boots nib size shopmycloset,['fashion_&_style']
shine city little funk soul,['arts_&_culture' 'film_tv_&_video' 'music']
koeman arrival alter priority lautaro martinez number list club plan make new attempt early september time lautaro martinez operation return line fcb,['news_&_social_concern' 'sports']
st come second good game cricket lose toss bat fairly decent start milky getting ish wicket begin tumble steady ship club temple set victory spike,['sports']
nowplaye champion drem tgi listen dremtgi dremstuff,['music' 'sports']
woman charge take maga hat boy outside democratic national convention epoch olivia winslow charge second degree robbery second degree conspiracy endanger welfare child wilmington police,['news_&_social_concern']
pong unconscious hit ground stay trainer give thumb ok minute later give magical pass wrap game year retire sue brain injury hiaisajoke nrlknightscowboy,['fitness_&_health' 'sports']
thiago tell bayern chief intention join liverpool champions league final red make tentative step sign,['sports']
understand blame china government draw line right think focus eliminate virus instead continue complaining change past fix situation future,['news_&_social_concern']
club reporter stan whitemast eulogise evo catch ability,['news_&_social_concern' 'sports']
country accept principle fail agree difference interpretation procedure seventy year line pakistan ambassador turkey,['news_&_social_concern']
break like glass like paper try tear rise ground skyscraper,['music']
new aleka attic song come like omg new fav song love thank rain good,['celebrity_&_pop_culture' 'music']
rockliff rozee power attack alphabetically line aretha franklin sing play kick pocket swear higgin build house sta roof,['music']
shine city little funk soul ma light like dynamite woah oh oh sb sbonwishnotesofhope,['celebrity_&_pop_culture' 'music']
dane mccullough sign burnley fc nice insight mccullough sign burnley show important revamp barnfield centre club,['celebrity_&_pop_culture' 'sports']
birikwalira say viper president surround treacherous people add miss club despite bring year advise club respect long serve player like,['news_&_social_concern' 'sports']
mary trump come swinge,['news_&_social_concern']
thiago silva basically deal pick narrator literally say captain game club,['news_&_social_concern' 'sports']
ben send shot ground bounce crossbar asmsdr,['news_&_social_concern' 'sports']
check add closet poshmark limited jean new tag size shopmycloset,['fashion_&_style']
constitution finland chapter basic right liberty section equality equal law shall acceptable reason treat differently person ground origin language criminal,['news_&_social_concern']
icymi sheffield united player reportedly test positive contact club comment,['fitness_&_health' 'news_&_social_concern' 'sports']
check add closet poshmark coach black peeptoe heel size shopmycloset,['fashion_&_style']
check add closet poshmark bennett shoe size shopmycloset,['fashion_&_style']
modi sir wish want postpone listen query come ground reality situation,['learning_&_educational' 'news_&_social_concern']
democratic national convention insane moment,['news_&_social_concern']
fyfe walter docker look dangerous line aretha franklin sing play kick centre square swear jacobs build house sta roof,['music' 'news_&_social_concern' 'sports']
line speak stand truth adverse condition flood covid beg ironically democracy life listen ramesh pokhriyal save don politicise,['fitness_&_health' 'learning_&_educational' 'news_&_social_concern']
xceptionalplaylist djtakeover love club raymond wherehitmusiclive sundayattherhythm weekendvibe,['music']
join support democratic national committee dnc direct marketing,['news_&_social_concern']
dragon line lock ball turn webb clear guinnesspro ospvdra,['sports']
check add closet poshmark bernie mev comfi shoes silver grey size shopmycloset,['fashion_&_style']
afraid come ground grow slowly step stair kim taehyung word heal taehyung love,['arts_&_culture' 'celebrity_&_pop_culture']
check phone case product ut maker available day supo step online business supo order product site thank,['business_&_entrepreneurs']
factor guy score anytime champion league final di odd odd joshua odd odd odd pick poison millionaire night uclfinal,['sports']
aoc ding democratic national convention target white moderate york,['news_&_social_concern']
win club yesterday beat run ably assist get well bowl bowl visitor highlight,['sports']
trump campaign say rnc incredible contrast democratic national convention aag aag,['news_&_social_concern']
live chill stream play guy undead watch champion league final give away gifted sub good prediction chat come tell future twitch twitchstreamer twitchaffiliate,['gaming' 'sports']
stun chequebook fraud manager pep fraudiola word player city crash champion league lyon didn dressing room match reveal oleksandr zinchenko,['sports']
train sheffield leed man ask mask strap ear not mask face funnnyyyyy xxx,['news_&_social_concern']
check add closet poshmark offer sale shopmycloset,['business_&_entrepreneurs' 'fashion_&_style']
certainty psg bayern win champion league,['sports']
shine city little funk soul ma light like dynamite woah oh oh mtvhottest bt,['celebrity_&_pop_culture' 'music']
bayern alphonso davy girlfriend jordyn huitema couple win champion league jordynhuitema story comment let know want,['relationships' 'sports']
dear dame announcement stadium fall refund credit plan saturday accordingly fall sincerely season ticket holder,['sports']
dem haven get white vote half century aoc ding democratic national convention target white moderate york,['news_&_social_concern']
hope big come cut promo love thunder dome summerslam,['sports']
strongly believe time leave paul george find rhythm go team afford pandemic shot find rhythm series coach adjust minute attempt rotation clippernation,['sports']
wow nba control put league notice luka change way view clipper wow wow wow wow,['sports']
request hall fame script bayern win champion league aminaandfareed,['sports']
tw police brutality gun violence shoot tony ever charge cop shoot jacob blake sign petition,['news_&_social_concern']
charge cop shoot jacob blake sign petition justiceforjacobblake,['news_&_social_concern']
tw police brutality tony ever charge cop shoot jacob blake sign petition,['news_&_social_concern']
dear paul george have plus playoff,['sports']
charge cop shoot jacob blake,['news_&_social_concern']
stephen put apb paul george app,['sports']
new dan guild offer takeaway round presidential polling follow democratic national convention,['news_&_social_concern']
sign petition charge cop shoot jacob blake sign petition org,['news_&_social_concern']
justiceforjacobblake tony ever charge cop shoot jacob blake firma la petizione org,['news_&_social_concern']
defund fire arrest cop try kill jacob blake,['news_&_social_concern']
retweet share sign instance go world let hope able pull tony ever charge cop shoot jacob blake sign petition,['news_&_social_concern']
charge cop shoot jacob blake sign petition blacklivesmatter justiceforjacobblake,['news_&_social_concern']
htownrush good tuesday morning laura look good la great day today safe prepare think wear mask,['diaries_&_daily_life' 'fitness_&_health' 'news_&_social_concern']
mavs vs clipper tonight cc,['sports']
sphs zoom parent meeting welcome good morning mr smalley discuss expectation zoom meeting mr moore introduce packet need drop,['learning_&_educational' 'youth_&_student_life']
democrats need stand chance win republican ground go door door rally depend lincoln carry,['news_&_social_concern']
sure hope right clipper cover tonight load,['sports']
yo play little bit defense bring energy bring clipper evergy welcome give win formula,['diaries_&_daily_life' 'sports']
montrezl harrell trash player patrick beverley paul george marcus morris clipper classless trash trash player trash organization mavs mffl wethenorth,['diaries_&_daily_life' 'sports']
legend donovan mitchell grow defeat maverick achille heel play clipper nba player boycott game right sport pm amet pm pmpt,['celebrity_&_pop_culture' 'diaries_&_daily_life' 'sports']
well disrespect place game shameless clipper hit game hand,['diaries_&_daily_life' 'sports']
hopefully return game need firepower able beat clipper mffl dallasin dallasmaverick mavs nba nbaplayoffs,['diaries_&_daily_life' 'sports']
guess hear criticism lord respond great game paul george,['celebrity_&_pop_culture' 'diaries_&_daily_life' 'sports']
arrest cop kill jacob blake,['diaries_&_daily_life' 'news_&_social_concern']
acab acab acab tony ever charge cop shoot jacob blake sign petition org,['diaries_&_daily_life' 'news_&_social_concern']
time speak rnc arrest cop kill breonna taylor essential worker specifically emt sleep bet,['diaries_&_daily_life' 'news_&_social_concern']
pleased morning assignment intro major class introductory video great actually student mask sta learn name personality,['diaries_&_daily_life' 'learning_&_educational' 'youth_&_student_life']
bubble largely success league avoid pitfall plague paul george admit anxiety depression feel away friend family,['sports']
charge cop shoot jacob blake sign petition unarmedvictim demandjusticeforjacobblake,['diaries_&_daily_life' 'news_&_social_concern']
imagine green bay bay wisconsin take knee practice refuse continue nfl season cop shoot jacob blake arrest,['diaries_&_daily_life' 'news_&_social_concern' 'sports']
update analysis day democratic national convention,['news_&_social_concern']
blacklivesmatter tony ever charge cop shoot jacob blake sign petition,['diaries_&_daily_life' 'news_&_social_concern']
imagine oblivious praise freedom speech rnc rattle player boycott imagine,['news_&_social_concern' 'sports']
armys slack let energy armys armys armys armys streaming dynamite spotify apple music exaarmy exabff,['celebrity_&_pop_culture' 'music']
convince main stream medium enemy america cover democratic national convention night refuse air republican convention seriously people wake watch uninterrupted amazing,['diaries_&_daily_life' 'news_&_social_concern']
kyle rittenhouse shoot people descript box america go burn ground fix un human idiot ar kill ppl away life changeisneede,['diaries_&_daily_life' 'news_&_social_concern']
police officer shoot jacob blake name detail incident release news black people america intentionally disobey disrespect law cop need education,['diaries_&_daily_life' 'news_&_social_concern']
kr cobain lil wretched cookin feature prod spotify apple music google play etc track sittin soundcloud energy run streaming platform,['celebrity_&_pop_culture' 'music']
sign lord pray justice tony ever charge cop shoot jacob blake sign petition,['diaries_&_daily_life' 'news_&_social_concern']
depression real chuck charles barkley blast paul george bubble depression stop complain,['fitness_&_health' 'news_&_social_concern' 'sports']
sinokasaparty type person walk club look para akong yung nautot sa jeep themorningrush,['celebrity_&_pop_culture' 'diaries_&_daily_life']
bit light listen saturday morning chairman kim berry hereford discuss club upcoming quarter final theonlyplacetoplay roadtolords nvc,['news_&_social_concern' 'sports']
charles barkley blast paul george bubble depression stop complain,['news_&_social_concern' 'sports']
remember chadwick boseman write life legacy man mask,['celebrity_&_pop_culture' 'film_tv_&_video']
think fair credibility topic outside bball objectively look jacob blake incident blame cop talk backside china educate jacobblake,"['celebrity_&_pop_culture' 'diaries_&_daily_life' 'news_&_social_concern'
 'sports']"
